{
  "tool": {
    "name": "qlm-measure",
    "version": "0.2.2",
    "language": "python",
    "catalog_version": "1"
  },
  "input": {
    "path": "tampered_value.json",
    "sha256": "9a87fdc52df3a79d1e69296ca1b801ecbaf6e8f77a4ec42118de649a9d61fc77",
    "records": 1
  },
  "generated_at": "2026-08-18T00:00:00Z",
  "records": [
    {
      "studentScopeId": "syn-8f2c-0042",
      "schemaVersion": "0.2",
      "entries_checked": 6,
      "valid": false,
      "checks": [
        {
          "id": "SCHEMA.REQUIRED",
          "status": "pass",
          "failures": 0
        },
        {
          "id": "SCHEMA.TYPES",
          "status": "pass",
          "failures": 0
        },
        {
          "id": "SCHEMA.TIMESTAMP_FORMAT",
          "status": "pass",
          "failures": 0
        },
        {
          "id": "VERSION.MONOTONIC",
          "status": "pass",
          "failures": 0
        },
        {
          "id": "TIMESTAMP.MONOTONIC",
          "status": "pass",
          "failures": 0
        },
        {
          "id": "ENUM.VALID",
          "status": "pass",
          "failures": 0
        },
        {
          "id": "HASH.PREV_LINK",
          "status": "pass",
          "failures": 0
        },
        {
          "id": "HASH.ENTRY_RECOMPUTE",
          "status": "fail",
          "failures": 1,
          "first_failure": {
            "version": 3,
            "message": "entryHash mismatch"
          }
        },
        {
          "id": "POSTERIOR.CHAIN",
          "status": "fail",
          "failures": 1,
          "first_failure": {
            "version": 4,
            "message": "priorPosterior (0.363) != previous updatedPosterior (0.463)"
          }
        },
        {
          "id": "COMPACTION.BOUNDARY",
          "status": "not_applicable",
          "failures": 0
        }
      ],
      "violations": [
        {
          "version": 3,
          "check_id": "HASH.ENTRY_RECOMPUTE",
          "category": "hash",
          "message": "entryHash mismatch"
        },
        {
          "version": 4,
          "check_id": "POSTERIOR.CHAIN",
          "category": "posterior",
          "message": "priorPosterior (0.363) != previous updatedPosterior (0.463)"
        }
      ]
    }
  ],
  "summary": {
    "records": 1,
    "valid": 0,
    "invalid": 1,
    "checks_run": 9,
    "checks_passed": 7,
    "checks_failed": 2,
    "checks_not_applicable": 1
  }
}
